{
  "kind": "dream_batch",
  "schema_version": "2.1",
  "run": {
    "id": "run-11111111-1111-4111-8111-111111111111",
    "scope": "workspace:example",
    "generated_at": "2026-07-18T00:05:00Z",
    "horizon": { "start": "2026-07-17T00:00:00Z", "end": "2026-07-18T00:00:00Z", "timezone": "Asia/Shanghai" },
    "context_hash": "2f01d80e6805157cd41e9e9159c6caa2de7304458f0443590ec7cf354144adaf",
    "idempotency_key": "workspace:example:2026-07-18T00:00:00Z:2.1",
    "known_state": { "signals": 0, "topics": 0, "evidence": 0 },
    "cursor": { "before": null, "candidate_after": "2026-07-18T00:00:00Z", "advance_on_publish": true },
    "outcome": "findings",
    "notes": "One evidence-backed persistence signal was promoted.",
    "candidates": [{ "id": "cand-22222222-2222-4222-8222-222222222222", "title": "Durable Dream state", "disposition": "promoted_new", "reason": "The mechanism changes state ownership.", "compared_signal_ids": [], "compared_topic_ids": [] }],
    "suppression_groups": []
  },
  "signal_changes": [{
    "change_id": "schg-44444444-4444-4444-8444-444444444444",
    "change_type": "create",
    "signal_id": "sig-33333333-3333-4333-8333-333333333333",
    "candidate_id": "cand-22222222-2222-4222-8222-222222222222",
    "revision": {
      "id": "srev-55555555-5555-4555-8555-555555555555",
      "title": "Dream state moves into a durable ledger",
      "status": "active",
      "fingerprint": { "current": "cccccccccccccccccccccccccccccccccccccccccccccccccccccccccccccccc", "aliases": [] },
      "repositories": ["example/vigil@main"],
      "summary": "Dream is adopting durable state rather than ephemeral summaries.",
      "baseline": "Only periodic summaries were durable.",
      "delta": "A Signal and Topic ledger is now part of the architecture.",
      "mechanism": "A transactional store owns stable identities and append-only revisions.",
      "consequence": "Trend judgments can be revised and de-duplicated across days.",
      "evidence_boundary": "The supplied evidence establishes design adoption, not production scale.",
      "direction": "hardening",
      "importance": 0.82,
      "confidence": 0.58,
      "facts": [{ "claim": "The commit and focused tests establish a persistent ledger.", "evidence_ids": ["ev-fff1024131eff094", "ev-b1af23d8da3c900c"] }],
      "inferences": ["Stable identity should reduce duplicate daily findings."],
      "counter_evidence_ids": [],
      "unknowns": ["Production contention is not yet observed."],
      "next_checks": ["Verify a repeated horizon creates no duplicate Signal."],
      "evidence_ids": ["ev-fff1024131eff094", "ev-b1af23d8da3c900c"],
      "forecast_evaluations": [],
      "forecasts": [{ "id": "fc-99999999-9999-4999-8999-999999999999", "claim": "Repeated input will update or suppress this Signal rather than recreate it.", "due_at": "2026-07-25T00:00:00Z", "expected_observations": ["A duplicate-only or update run references this Signal ID."] }],
      "supersedes": null,
      "superseded_by": null
    }
  }],
  "topic_decision": { "action": "create", "reason": "The persistence mechanism has durable identity, transaction, and revision semantics worth explaining." },
  "topic_changes": [{
    "change_id": "tchg-77777777-7777-4777-8777-777777777777",
    "change_type": "create",
    "topic_id": "top-66666666-6666-4666-8666-666666666666",
    "candidate_id": "cand-22222222-2222-4222-8222-222222222222",
    "revision": {
      "id": "trev-88888888-8888-4888-8888-888888888888",
      "title": "Append-only repository intelligence state",
      "status": "active",
      "fingerprint": { "current": "dddddddddddddddddddddddddddddddddddddddddddddddddddddddddddddddd", "aliases": [] },
      "summary": "How stable identity, revisions, and transactions turn reports into revisable knowledge.",
      "thesis": "The ledger separates current projections from immutable reasoning history.",
      "scope": ["Dream state", "Signal and Topic lifecycle"],
      "mechanism": "Stable UUID identity, fingerprint aliases, append-only revisions, and cursor-last transactions.",
      "applicability": "Daily repository intelligence where repeated observations overlap.",
      "boundaries": ["Does not prove semantic duplicate retrieval at unlimited scale."],
      "signal_ids": ["sig-33333333-3333-4333-8333-333333333333"],
      "evidence_ids": ["ev-fff1024131eff094", "ev-b1af23d8da3c900c"],
      "findings": [{ "claim": "Durable identity is distinct from an evolving fingerprint.", "basis": "inference", "evidence_ids": ["ev-fff1024131eff094"] }],
      "counter_evidence_ids": [],
      "unknowns": ["Long-term ledger size is unmeasured."],
      "engineering_implications": ["Cursor movement must be coupled to the same transaction as revisions."],
      "next_checks": ["Exercise stale-version and rollback behavior."],
      "supersedes": null,
      "superseded_by": null
    }
  }]
}
